{
  "$schema": "https://json-schema.org/draft/2020-12/schema",
  "$id": "https://pagedigest.org/pagedigest.schema.json",
  "title": "pagedigest v1",
  "$comment": "Validation against this schema is not the full conformance boundary. Normative URL-key and protocol semantics are defined in SPEC.md and must be applied in addition to schema checks.",
  "type": "object",
  "additionalProperties": true,
  "required": [
    "version",
    "generated",
    "site_rev",
    "entries"
  ],
  "properties": {
    "version": {
      "type": "integer",
      "const": 1
    },
    "generated": {
      "type": "string",
      "format": "date-time"
    },
    "site_rev": {
      "type": "integer",
      "minimum": 0
    },
    "coverage": {
      "$ref": "#/$defs/coverage"
    },
    "entries": {
      "type": "object",
      "$comment": "The pattern intentionally permits '/?' as a distinct origin-relative request target key. Publishers should include only materially distinct keys per SPEC guidance.",
      "propertyNames": {
        "type": "string",
        "pattern": "^/([^#]*)?$"
      },
      "additionalProperties": {
        "$ref": "#/$defs/entry"
      }
    }
  },
  "$defs": {
    "coverage": {
      "oneOf": [
        {
          "type": "object",
          "additionalProperties": true,
          "required": [
            "mode"
          ],
          "properties": {
            "mode": {
              "const": "complete"
            }
          }
        },
        {
          "type": "object",
          "additionalProperties": true,
          "required": [
            "mode",
            "prefixes"
          ],
          "properties": {
            "mode": {
              "const": "prefixes"
            },
            "prefixes": {
              "type": "array",
              "minItems": 1,
              "items": {
                "type": "string",
                "pattern": "^/"
              }
            }
          }
        }
      ]
    },
    "entry": {
      "type": "object",
      "additionalProperties": true,
      "required": [
        "rev"
      ],
      "properties": {
        "rev": {
          "type": "integer",
          "minimum": 0
        },
        "digest": {
          "type": "string",
          "pattern": "^sha256:[a-f0-9]{64}$"
        },
        "modified": {
          "type": "string",
          "format": "date-time"
        }
      }
    }
  }
}
