{
  "version": 1,
  "generated": "2026-04-17T12:05:00Z",
  "site_rev": 142,
  "entries": {
    "/": {
      "rev": 14,
      "digest": "sha256:12c4be9a5f4a4a4376a6f4f7c9e1619f0fcb9c6dbb334d99d76d28b9f8578c43"
    },
    "/docs/start": {
      "rev": 3,
      "digest": "sha256:4d4f877f4f36ac0a31ba82f269d35f7a78fc6bd6f183f064f2f6b8ff23e7b57e"
    }
  }
}
