{
  "version": 1,
  "generated": "2026-04-17T12:45:00Z",
  "site_rev": 18,
  "entries": {
    "/about": {
      "rev": 1
    },
    "/about/": {
      "rev": 2
    },
    "/pricing?region=us": {
      "rev": 1
    },
    "/posts/hello%20world": {
      "rev": 3
    },
    "/caf%C3%A9/": {
      "rev": 1
    },
    "/100%25.html": {
      "rev": 1
    },
    "/a%5Bb%5D.html": {
      "rev": 1
    },
    "/hello%20world.html": {
      "rev": 1
    },
    "/hello%2520world.html": {
      "rev": 1
    }
  }
}
